{
  "version": 1,
  "task_id": "TASK-0033",
  "source_ref": "d030db5dc2974056387616d047197823b94602ce",
  "source_tree": "f5a5fde073836bc9965b9a05ae4ccf06f36eccaa",
  "target_repository": "agent-harness",
  "project_sha256": "031b8315e0f96088be4efe8fc17cc018a77c779434599c8bf92b38ebc9d63a7f",
  "category_counts": {
    "historical_tasks": 32,
    "current_tasks": 1,
    "task_files": 198,
    "wiki_files": 29,
    "lap30_files": 1
  },
  "entries": [
    {
      "file": "backlog.yaml",
      "origin": "TASK-0033-overlay",
      "bytes": 17330,
      "sha256": "5e76213e03ce3e50a408b03e0a8f6ae80b3551d61cc077ccd0b07674b5937e0b"
    },
    {
      "file": "lap30/events.jsonl",
      "origin": "REF-2",
      "bytes": 521841,
      "sha256": "3fa7711738b10baa0b7cc52f30fcab3d175160a1e3ee01883c97dc8ed8663bd7"
    },
    {
      "file": "tasks/TASK-0001-development-process-foundation/HANDOVER.md",
      "origin": "REF-2",
      "bytes": 3235,
      "sha256": "18d290c1c1899d65d37af783ccf337ba0596add7f2a9237662e44423c9e7fc90"
    },
    {
      "file": "tasks/TASK-0001-development-process-foundation/PLAN.md",
      "origin": "REF-2",
      "bytes": 5545,
      "sha256": "e1571f200918e8edea0eb1277ed2eca747e97aad4c9ba668976948461501405e"
    },
    {
      "file": "tasks/TASK-0001-development-process-foundation/QA_PLAN.md",
      "origin": "REF-2",
      "bytes": 3067,
      "sha256": "95d39b72e3e4537fa9ef6b329fceea1c7f36df1233de63515b755eae7b922ce6"
    },
    {
      "file": "tasks/TASK-0001-development-process-foundation/QA_RESULT.md",
      "origin": "REF-2",
      "bytes": 1763,
      "sha256": "881d55a9d8f2b8fb6c8819fac5da7d7c20ea40ba751c9e3142b5ae815f9039d6"
    },
    {
      "file": "tasks/TASK-0001-development-process-foundation/REVIEW_RESULT.md",
      "origin": "REF-2",
      "bytes": 2157,
      "sha256": "38dcdda22aedb707d275a900e9970c2bfc5b42c2488471489c9347ba58f9e9e1"
    },
    {
      "file": "tasks/TASK-0001-development-process-foundation/TASK.md",
      "origin": "REF-2",
      "bytes": 4101,
      "sha256": "acb1d772016d3db18846292a375c6a6b0e77b0b35b20d7a2845f17cc0c4c5f6f"
    },
    {
      "file": "tasks/TASK-0002-codex-agent-model-routing/HANDOVER.md",
      "origin": "REF-2",
      "bytes": 4675,
      "sha256": "4098e1c14ae34f54484774ea23ac941c0b6cd8484321f52fd35bd08b260547f8"
    },
    {
      "file": "tasks/TASK-0002-codex-agent-model-routing/PLAN.md",
      "origin": "REF-2",
      "bytes": 17228,
      "sha256": "7f26bfd631437b508978c918351b098efa510421b72d3418a1d82a372cc14b89"
    },
    {
      "file": "tasks/TASK-0002-codex-agent-model-routing/QA_PLAN.md",
      "origin": "REF-2",
      "bytes": 16949,
      "sha256": "da99b1b7093f1465371128ccb5a5d1649fff794bdcd1c7d4405bf4956b8c4ccd"
    },
    {
      "file": "tasks/TASK-0002-codex-agent-model-routing/QA_RESULT.md",
      "origin": "REF-2",
      "bytes": 6105,
      "sha256": "9bbc2e90bc8ac4eec7bcde5d44cf7328aad203c39226cc6c9832ca829a05ee84"
    },
    {
      "file": "tasks/TASK-0002-codex-agent-model-routing/REVIEW_RESULT.md",
      "origin": "REF-2",
      "bytes": 3546,
      "sha256": "27f65f72a6516568f3697a28cfab5bd202067162c56cfad9db6d66d7da7846c6"
    },
    {
      "file": "tasks/TASK-0002-codex-agent-model-routing/TASK.md",
      "origin": "REF-2",
      "bytes": 10636,
      "sha256": "3317432fdca3539edb5b28ac42ad8b0d438c98dc0f94e2a48dc35c7542777758"
    },
    {
      "file": "tasks/TASK-0003-multi-agent-v2-nested-explorer/HANDOVER.md",
      "origin": "REF-2",
      "bytes": 4711,
      "sha256": "6a6b8f036b683a303cdeed8c07b645b1a01d2e3ed80e13a580a853752a6b5917"
    },
    {
      "file": "tasks/TASK-0003-multi-agent-v2-nested-explorer/PLAN.md",
      "origin": "REF-2",
      "bytes": 13504,
      "sha256": "786d77423ae3d732a473f72cf0ac10e152c66a5da2b2ac40535d991e0ffa04cc"
    },
    {
      "file": "tasks/TASK-0003-multi-agent-v2-nested-explorer/QA_PLAN.md",
      "origin": "REF-2",
      "bytes": 10432,
      "sha256": "ecf7351c1dfca940c327bdec69221d90dfbe7e1169ebd0bb3b541ba2971bc742"
    },
    {
      "file": "tasks/TASK-0003-multi-agent-v2-nested-explorer/QA_RESULT.md",
      "origin": "REF-2",
      "bytes": 4759,
      "sha256": "24c500cae0956b02d7b18e6f4f970742a763ee5630cba4cd1244d7b52b862cde"
    },
    {
      "file": "tasks/TASK-0003-multi-agent-v2-nested-explorer/REVIEW_RESULT.md",
      "origin": "REF-2",
      "bytes": 3770,
      "sha256": "a9d0d9b071331ffffbb805b01f4a7d4e40b4a211cbef544c6b4621498faa57eb"
    },
    {
      "file": "tasks/TASK-0003-multi-agent-v2-nested-explorer/TASK.md",
      "origin": "REF-2",
      "bytes": 4954,
      "sha256": "3b69c6dbe6ff1195e47bf6d8673ed48c8e44d8e63adea065506a9177f7d40151"
    },
    {
      "file": "tasks/TASK-0004-remove-redundant-agent-depth-limits/HANDOVER.md",
      "origin": "REF-2",
      "bytes": 6536,
      "sha256": "f6078acfb3be7da33e1d01989475dde0a4be1f932ec010bd139a5a017d19490a"
    },
    {
      "file": "tasks/TASK-0004-remove-redundant-agent-depth-limits/PLAN.md",
      "origin": "REF-2",
      "bytes": 14160,
      "sha256": "7edf2e55d42931ddf39f250fd59f5adf57ac4102a8e1b1f1fad5165c2c85a620"
    },
    {
      "file": "tasks/TASK-0004-remove-redundant-agent-depth-limits/QA_PLAN.md",
      "origin": "REF-2",
      "bytes": 9635,
      "sha256": "2aae848e672c2d0f61e8082b56a77ae54035c81689ee3864d4cc4dbadba793e6"
    },
    {
      "file": "tasks/TASK-0004-remove-redundant-agent-depth-limits/QA_RESULT.md",
      "origin": "REF-2",
      "bytes": 3624,
      "sha256": "3c4d17081f97027e5951e031803fe20016fe16d316c8f8cc5e5ceadd1df0e294"
    },
    {
      "file": "tasks/TASK-0004-remove-redundant-agent-depth-limits/REVIEW_RESULT.md",
      "origin": "REF-2",
      "bytes": 4475,
      "sha256": "786d7d30df525c9708acfab51a106cf73a029ee0cfc255ca281a24d4528e7a79"
    },
    {
      "file": "tasks/TASK-0004-remove-redundant-agent-depth-limits/TASK.md",
      "origin": "REF-2",
      "bytes": 11343,
      "sha256": "b41991c88356da30ada01072d037b074cac2240bc3b5bcaad05cc4fc94de6a99"
    },
    {
      "file": "tasks/TASK-0005-main-agent-efficient-delivery/HANDOVER.md",
      "origin": "REF-2",
      "bytes": 2943,
      "sha256": "4661c4e390edd48ffabbf553c31fbc28ddf6c03280f374bc92bd218c991fde9b"
    },
    {
      "file": "tasks/TASK-0005-main-agent-efficient-delivery/PLAN.md",
      "origin": "REF-2",
      "bytes": 15557,
      "sha256": "a61d4d06820136d26f1b78ff61c056d9e84b130a5206036378decc9276519783"
    },
    {
      "file": "tasks/TASK-0005-main-agent-efficient-delivery/QA_PLAN.md",
      "origin": "REF-2",
      "bytes": 9764,
      "sha256": "3bcff34330dd5e99a5fe34a014f13870530045574f08524370ae101e937dedaf"
    },
    {
      "file": "tasks/TASK-0005-main-agent-efficient-delivery/QA_RESULT.md",
      "origin": "REF-2",
      "bytes": 4935,
      "sha256": "99b7f7e36499c026017274b52e930653c19b92d493c869fbb9c37aa207d23bc3"
    },
    {
      "file": "tasks/TASK-0005-main-agent-efficient-delivery/REVIEW_RESULT.md",
      "origin": "REF-2",
      "bytes": 2676,
      "sha256": "a9dba869c2bc022b7ca16edf67595705936d9c44f5f45645ef3e8b8dec43b0d1"
    },
    {
      "file": "tasks/TASK-0005-main-agent-efficient-delivery/TASK.md",
      "origin": "REF-2",
      "bytes": 6550,
      "sha256": "9813e63d1836bf0406531da0fbaf57a9b153b21249e244db637a666eccbc154c"
    },
    {
      "file": "tasks/TASK-0006-mvp-wire-contracts/HANDOVER.md",
      "origin": "REF-2",
      "bytes": 10142,
      "sha256": "0d9a7e0a5f5fc7f7b298c0fa2dfd2d65022196a19558432b6e2e4552cd038c40"
    },
    {
      "file": "tasks/TASK-0006-mvp-wire-contracts/PLAN.md",
      "origin": "REF-2",
      "bytes": 15485,
      "sha256": "22020dff9aec1e1b6c3b91f242bc2f66fc479dbf6985c9c57023d4fa738f19e6"
    },
    {
      "file": "tasks/TASK-0006-mvp-wire-contracts/QA_PLAN.md",
      "origin": "REF-2",
      "bytes": 9912,
      "sha256": "f25b289ceff498bd03103993ab9257a5430251720fb29c7f82173b89ce24a9bb"
    },
    {
      "file": "tasks/TASK-0006-mvp-wire-contracts/QA_RESULT.md",
      "origin": "REF-2",
      "bytes": 4390,
      "sha256": "3995bced319fc9e6cac023cca7ce646ec0f9be932154754bf5245c86381462bd"
    },
    {
      "file": "tasks/TASK-0006-mvp-wire-contracts/REVIEW_RESULT.md",
      "origin": "REF-2",
      "bytes": 4027,
      "sha256": "6aee5b5d895c1c1352841b1c541671d6a13dfe380d212788c31253cc6d1c8a70"
    },
    {
      "file": "tasks/TASK-0006-mvp-wire-contracts/TASK.md",
      "origin": "REF-2",
      "bytes": 3459,
      "sha256": "020e627ea8ae3eb20fd5503aeea77eef3d2fc2dcccd7c11a9e1de301da00022f"
    },
    {
      "file": "tasks/TASK-0007-control-durable-task-store/HANDOVER.md",
      "origin": "REF-2",
      "bytes": 449,
      "sha256": "5893e246e2df684e4b007908a44553bf802d72728fba7934b178723da7757c85"
    },
    {
      "file": "tasks/TASK-0007-control-durable-task-store/PLAN.md",
      "origin": "REF-2",
      "bytes": 9307,
      "sha256": "426bf1cd4da18ad647b6850bc8fb4014ac473c91ef0064ac26557aeefaae7994"
    },
    {
      "file": "tasks/TASK-0007-control-durable-task-store/QA_PLAN.md",
      "origin": "REF-2",
      "bytes": 942,
      "sha256": "00a9ec651701f5a60a3a60c116293f8477b7f81db879a23144316aa2a74aeb4e"
    },
    {
      "file": "tasks/TASK-0007-control-durable-task-store/QA_RESULT.md",
      "origin": "REF-2",
      "bytes": 576,
      "sha256": "f3fac4086105b9402d699072a13b3ebcc9405ad47b1e4da63a7f7ddd4e46c663"
    },
    {
      "file": "tasks/TASK-0007-control-durable-task-store/REVIEW_RESULT.md",
      "origin": "REF-2",
      "bytes": 605,
      "sha256": "150d418f4c9780aa216e4423eb11340912a72cf28b88ca62ca3270422149690b"
    },
    {
      "file": "tasks/TASK-0007-control-durable-task-store/TASK.md",
      "origin": "REF-2",
      "bytes": 3702,
      "sha256": "23b9469f7089962d4560293bac63d22a5f4389eee08b61f97cdac37bb0a9a29a"
    },
    {
      "file": "tasks/TASK-0008-cross-plane-transport/HANDOVER.md",
      "origin": "REF-2",
      "bytes": 449,